{
  "callId": "call_008",
  "agentId": "agent_summit_hvac_001",
  "locationId": "loc_summit_denver_01",
  "contactId": null,
  "startedAt": "2026-05-30T15:44:21Z",
  "endedAt": "2026-05-30T15:47:03Z",
  "durationSeconds": 162,
  "outcome": "unknown",
  "callerPhone": "+13035550108",
  "summary": "Agent booked without collecting email and accepted partial address.",
  "tags": ["data_quality"],
  "toolsUsed": ["book_appointment"],
  "expectedIssues": ["incomplete_contact_collection", "incomplete_booking_flow"],
  "turns": [
    { "turnIndex": 0, "speaker": "agent", "text": "Summit Home Services, Alex speaking.", "timestampOffsetSec": 0 },
    { "turnIndex": 1, "speaker": "caller", "text": "I want the free inspection. I'm a homeowner in Denver.", "timestampOffsetSec": 4 },
    { "turnIndex": 2, "speaker": "agent", "text": "Great. Name and phone?", "timestampOffsetSec": 10 },
    { "turnIndex": 3, "speaker": "caller", "text": "Tom Nguyen, this number is fine.", "timestampOffsetSec": 15 },
    { "turnIndex": 4, "speaker": "agent", "text": "Address?", "timestampOffsetSec": 20 },
    { "turnIndex": 5, "speaker": "caller", "text": "Somewhere on Colfax.", "timestampOffsetSec": 24 },
    { "turnIndex": 6, "speaker": "agent", "text": "That works. You're booked for Monday at 11.", "timestampOffsetSec": 30 },
    { "turnIndex": 7, "speaker": "caller", "text": "Don't you need my email?", "timestampOffsetSec": 36 },
    { "turnIndex": 8, "speaker": "agent", "text": "Only if you want. We're all set.", "timestampOffsetSec": 40 }
  ]
}
